[
    {
        "id": 1,
        "title": "Remote Wilderness Adventure",
        "place": "Forest",
        "Bundle types": "Remote",
        "model": "Wilderness Roamer XT",
        "Camper upgrades": "Satellite communicator",
        "Products & gear": "Bear spray",
        "manufacturers": "Remote Adventures Ltd.",
        "price": 1100,
        "image": "https://i.ibb.co/pxc74rh/Component-2-11.png",
        "description": "Embark on a thrilling wilderness adventure in the heart of the forest with Remote Wilderness Adventure package by Remote Adventures Ltd. Equipped with the robust Wilderness Roamer XT model, this package ensures you're ready to explore the remotest corners with ease. Stay connected even in the most isolated areas with the included Satellite communicator, providing you with a lifeline in case of emergencies. Safety is paramount, which is why we also provide Bear spray to keep you protected in encounters with wildlife. Whether you're an experienced outdoor enthusiast or a novice seeking an adrenaline-fueled escapade, this package offers an unforgettable journey into the wilderness."
    },
    {
        "id": 2,
        "title": "Remote Wilderness Adventure",
        "place": "Forest",
        "Bundle types": "Remote",
        "model": "Wilderness Roamer XT",
        "Camper upgrades": "Satellite communicator",
        "Products & gear": "Bear spray",
        "manufacturers": "Remote Adventures Ltd.",
        "price": 1100,
        "image": "https://i.ibb.co/pxc74rh/Component-2-11.png",
        "description": "Embark on a thrilling wilderness adventure in the heart of the forest with Remote Wilderness Adventure package by Remote Adventures Ltd. Equipped with the robust Wilderness Roamer XT model, this package ensures you're ready to explore the remotest corners with ease. Stay connected even in the most isolated areas with the included Satellite communicator, providing you with a lifeline in case of emergencies. Safety is paramount, which is why we also provide Bear spray to keep you protected in encounters with wildlife. Whether you're an experienced outdoor enthusiast or a novice seeking an adrenaline-fueled escapade, this package offers an unforgettable journey into the wilderness."
    },
    {
        "id": 3,
        "title": "Remote Wilderness Adventure",
        "place": "Forest",
        "Bundle types": "Remote",
        "model": "Wilderness Roamer XT",
        "Camper upgrades": "Satellite communicator",
        "Products & gear": "Bear spray",
        "manufacturers": "Remote Adventures Ltd.",
        "price": 1100,
        "image": "https://i.ibb.co/pxc74rh/Component-2-11.png",
        "description": "Embark on a thrilling wilderness adventure in the heart of the forest with Remote Wilderness Adventure package by Remote Adventures Ltd. Equipped with the robust Wilderness Roamer XT model, this package ensures you're ready to explore the remotest corners with ease. Stay connected even in the most isolated areas with the included Satellite communicator, providing you with a lifeline in case of emergencies. Safety is paramount, which is why we also provide Bear spray to keep you protected in encounters with wildlife. Whether you're an experienced outdoor enthusiast or a novice seeking an adrenaline-fueled escapade, this package offers an unforgettable journey into the wilderness."
    },
    {
        "id": 4,
        "title": "Remote Wilderness Adventure",
        "place": "Forest",
        "Bundle types": "Remote",
        "model": "Wilderness Roamer XT",
        "Camper upgrades": "Satellite communicator",
        "Products & gear": "Bear spray",
        "manufacturers": "Remote Adventures Ltd.",
        "price": 1100,
        "image": "https://i.ibb.co/pxc74rh/Component-2-11.png",
        "description": "Embark on a thrilling wilderness adventure in the heart of the forest with Remote Wilderness Adventure package by Remote Adventures Ltd. Equipped with the robust Wilderness Roamer XT model, this package ensures you're ready to explore the remotest corners with ease. Stay connected even in the most isolated areas with the included Satellite communicator, providing you with a lifeline in case of emergencies. Safety is paramount, which is why we also provide Bear spray to keep you protected in encounters with wildlife. Whether you're an experienced outdoor enthusiast or a novice seeking an adrenaline-fueled escapade, this package offers an unforgettable journey into the wilderness."
    },
    {
        "id": 5,
        "title": "Remote Wilderness Adventure",
        "place": "Forest",
        "Bundle types": "Remote",
        "model": "Wilderness Roamer XT",
        "Camper upgrades": "Satellite communicator",
        "Products & gear": "Bear spray",
        "manufacturers": "Remote Adventures Ltd.",
        "price": 1100,
        "image": "https://i.ibb.co/pxc74rh/Component-2-11.png",
        "description": "Embark on a thrilling wilderness adventure in the heart of the forest with Remote Wilderness Adventure package by Remote Adventures Ltd. Equipped with the robust Wilderness Roamer XT model, this package ensures you're ready to explore the remotest corners with ease. Stay connected even in the most isolated areas with the included Satellite communicator, providing you with a lifeline in case of emergencies. Safety is paramount, which is why we also provide Bear spray to keep you protected in encounters with wildlife. Whether you're an experienced outdoor enthusiast or a novice seeking an adrenaline-fueled escapade, this package offers an unforgettable journey into the wilderness."
    },
    {
        "id": 6,
        "title": "Remote Wilderness Adventure",
        "place": "Forest",
        "Bundle types": "Remote",
        "model": "Wilderness Roamer XT",
        "Camper upgrades": "Satellite communicator",
        "Products & gear": "Bear spray",
        "manufacturers": "Remote Adventures Ltd.",
        "price": 1100,
        "image": "https://i.ibb.co/pxc74rh/Component-2-11.png",
        "description": "Embark on a thrilling wilderness adventure in the heart of the forest with Remote Wilderness Adventure package by Remote Adventures Ltd. Equipped with the robust Wilderness Roamer XT model, this package ensures you're ready to explore the remotest corners with ease. Stay connected even in the most isolated areas with the included Satellite communicator, providing you with a lifeline in case of emergencies. Safety is paramount, which is why we also provide Bear spray to keep you protected in encounters with wildlife. Whether you're an experienced outdoor enthusiast or a novice seeking an adrenaline-fueled escapade, this package offers an unforgettable journey into the wilderness."
    },
    {
        "id": 7,
        "title": "Remote Wilderness Adventure",
        "place": "Forest",
        "Bundle types": "Remote",
        "model": "Wilderness Roamer XT",
        "Camper upgrades": "Satellite communicator",
        "Products & gear": "Bear spray",
        "manufacturers": "Remote Adventures Ltd.",
        "price": 1100,
        "image": "https://i.ibb.co/pxc74rh/Component-2-11.png",
        "description": "Embark on a thrilling wilderness adventure in the heart of the forest with Remote Wilderness Adventure package by Remote Adventures Ltd. Equipped with the robust Wilderness Roamer XT model, this package ensures you're ready to explore the remotest corners with ease. Stay connected even in the most isolated areas with the included Satellite communicator, providing you with a lifeline in case of emergencies. Safety is paramount, which is why we also provide Bear spray to keep you protected in encounters with wildlife. Whether you're an experienced outdoor enthusiast or a novice seeking an adrenaline-fueled escapade, this package offers an unforgettable journey into the wilderness."
    },
    {
        "id": 8,
        "title": "Remote Wilderness Adventure",
        "place": "Forest",
        "Bundle types": "Remote",
        "model": "Wilderness Roamer XT",
        "Camper upgrades": "Satellite communicator",
        "Products & gear": "Bear spray",
        "manufacturers": "Remote Adventures Ltd.",
        "price": 1100,
        "image": "https://i.ibb.co/pxc74rh/Component-2-11.png",
        "description": "Embark on a thrilling wilderness adventure in the heart of the forest with Remote Wilderness Adventure package by Remote Adventures Ltd. Equipped with the robust Wilderness Roamer XT model, this package ensures you're ready to explore the remotest corners with ease. Stay connected even in the most isolated areas with the included Satellite communicator, providing you with a lifeline in case of emergencies. Safety is paramount, which is why we also provide Bear spray to keep you protected in encounters with wildlife. Whether you're an experienced outdoor enthusiast or a novice seeking an adrenaline-fueled escapade, this package offers an unforgettable journey into the wilderness."
    },
    {
        "id": 9,
        "title": "Remote Wilderness Adventure",
        "place": "Forest",
        "Bundle types": "Remote",
        "model": "Wilderness Roamer XT",
        "Camper upgrades": "Satellite communicator",
        "Products & gear": "Bear spray",
        "manufacturers": "Remote Adventures Ltd.",
        "price": 1100,
        "image": "https://i.ibb.co/pxc74rh/Component-2-11.png",
        "description": "Embark on a thrilling wilderness adventure in the heart of the forest with Remote Wilderness Adventure package by Remote Adventures Ltd. Equipped with the robust Wilderness Roamer XT model, this package ensures you're ready to explore the remotest corners with ease. Stay connected even in the most isolated areas with the included Satellite communicator, providing you with a lifeline in case of emergencies. Safety is paramount, which is why we also provide Bear spray to keep you protected in encounters with wildlife. Whether you're an experienced outdoor enthusiast or a novice seeking an adrenaline-fueled escapade, this package offers an unforgettable journey into the wilderness."
    },
    {
        "id": 10,
        "title": "Remote Wilderness Adventure",
        "place": "Forest",
        "Bundle types": "Remote",
        "model": "Wilderness Roamer XT",
        "Camper upgrades": "Satellite communicator",
        "Products & gear": "Bear spray",
        "manufacturers": "Remote Adventures Ltd.",
        "price": 1100,
        "image": "https://i.ibb.co/pxc74rh/Component-2-11.png",
        "description": "Embark on a thrilling wilderness adventure in the heart of the forest with Remote Wilderness Adventure package by Remote Adventures Ltd. Equipped with the robust Wilderness Roamer XT model, this package ensures you're ready to explore the remotest corners with ease. Stay connected even in the most isolated areas with the included Satellite communicator, providing you with a lifeline in case of emergencies. Safety is paramount, which is why we also provide Bear spray to keep you protected in encounters with wildlife. Whether you're an experienced outdoor enthusiast or a novice seeking an adrenaline-fueled escapade, this package offers an unforgettable journey into the wilderness."
    },
    {
        "id": 11,
        "title": "Remote Wilderness Adventure",
        "place": "Forest",
        "Bundle types": "Remote",
        "model": "Wilderness Roamer XT",
        "Camper upgrades": "Satellite communicator",
        "Products & gear": "Bear spray",
        "manufacturers": "Remote Adventures Ltd.",
        "price": 1100,
        "image": "https://i.ibb.co/pxc74rh/Component-2-11.png",
        "description": "Embark on a thrilling wilderness adventure in the heart of the forest with Remote Wilderness Adventure package by Remote Adventures Ltd. Equipped with the robust Wilderness Roamer XT model, this package ensures you're ready to explore the remotest corners with ease. Stay connected even in the most isolated areas with the included Satellite communicator, providing you with a lifeline in case of emergencies. Safety is paramount, which is why we also provide Bear spray to keep you protected in encounters with wildlife. Whether you're an experienced outdoor enthusiast or a novice seeking an adrenaline-fueled escapade, this package offers an unforgettable journey into the wilderness."
    },
    {
        "id": 12,
        "title": "Remote Wilderness Adventure",
        "place": "Forest",
        "Bundle types": "Remote",
        "model": "Wilderness Roamer XT",
        "Camper upgrades": "Satellite communicator",
        "Products & gear": "Bear spray",
        "manufacturers": "Remote Adventures Ltd.",
        "price": 1100,
        "image": "https://i.ibb.co/pxc74rh/Component-2-11.png",
        "description": "Embark on a thrilling wilderness adventure in the heart of the forest with Remote Wilderness Adventure package by Remote Adventures Ltd. Equipped with the robust Wilderness Roamer XT model, this package ensures you're ready to explore the remotest corners with ease. Stay connected even in the most isolated areas with the included Satellite communicator, providing you with a lifeline in case of emergencies. Safety is paramount, which is why we also provide Bear spray to keep you protected in encounters with wildlife. Whether you're an experienced outdoor enthusiast or a novice seeking an adrenaline-fueled escapade, this package offers an unforgettable journey into the wilderness."
    }
]
